{
  "schema_version": "1.0",
  "id": "US-0001",
  "title": "Validate Phase 0 contracts",
  "description": "Provide machine-validable representations of the certified contracts.",
  "status": "PROPOSED",
  "priority": 1,
  "risk": "LOW",
  "depends_on": [],
  "scope": {
    "allowed_paths": ["schemas/", "tests/fixtures/"],
    "forbidden_paths": ["src/"]
  },
  "acceptance_criteria": [
    {
      "id": "AC-001",
      "description": "All five schemas validate against Draft 2020-12.",
      "mandatory": true
    }
  ],
  "required_gates": ["GATE-0001"],
  "human_approval": {
    "required": false,
    "approved": false,
    "approved_by": null,
    "approved_at": null
  },
  "metadata": {
    "created_at": "2026-08-27T10:00:00+02:00",
    "created_by": "human-operator",
    "updated_at": "2026-08-27T10:00:00+02:00"
  }
}
